{
  "hearback_id": "0126-rb-onda-38-2-10-higiene-repositorio-confirmed",
  "readback_id": "0126-rb-onda-38-2-10-higiene-repositorio",
  "status": "confirmed",
  "signed_by": "mauricio-zanin",
  "signed_at": "2026-05-31T23:49:00-03:00",
  "notes": "Usuario confirmou: 'sim aprovado, vamos deixar tudo limpo, organizado e commitado com os avancos alcancados'. Escopo 0126 cobre higiene estrutural, consolidacao de artefatos das ondas 38.2.4 a 38.2.9 e commit final."
}
