{
  "hearback_id": "0132-rb-onda-38-2-16-bl4-protecao-persistente-confirmed",
  "readback_id": "0132-rb-onda-38-2-16-bl4-protecao-persistente",
  "status": "confirmed",
  "signed_by": "mauricio-zanin",
  "signed_at": "2026-06-01T10:40:27-03:00",
  "notes": "Mauricio confirmou em chat: confirmo o readback 0132-rb-onda-38-2-16-bl4-protecao-persistente. Escopo autorizado: BL-4 protecao persistente apos save/reopen, com excecao estreita para Auto_Open.bas apenas para reaplicacao/instrumentacao verificavel da protecao critica na abertura, testes V2 dirigidos, pacote V3 e documentacao HBN. Permanecem proibidos ThisWorkbook.code.txt, Mod_Types.bas, Importador_V3.bas, Preencher.bas, Menu_Principal.frm, Svc_*, Repo_*, .frx, formularios/demandante/impressao e freeze V206."
}
