{
  "hearback_id": "0129-rb-onda-38-2-13-auditoria-cruzada-consolidada-confirmed",
  "readback_id": "0129-rb-onda-38-2-13-auditoria-cruzada-consolidada",
  "status": "confirmed",
  "signed_by": "mauricio-zanin",
  "signed_at": "2026-06-01T08:44:43-03:00",
  "notes": "Mauricio confirmou em chat: confirmo o readback 0129-rb-onda-38-2-13-auditoria-cruzada-consolidada. Escopo autorizado: consolidacao documental da auditoria cruzada, sem codigo, sem VBA/importaveis e sem declarar freeze V206."
}
